{
  "automation_candidate": false,
  "cleanup": [],
  "execution_policy": {
    "allowed_modes": [
      "manual"
    ],
    "required_evidence": [
      "structured_manual_result"
    ]
  },
  "expected": [
    {
      "description": "三个变体均拒绝查看明细并返回错误码 s307011534。",
      "id": "EXP-BE-001-01",
      "oracle": {
        "expected_value": "s307011534",
        "matcher": "equals",
        "observation_point": "detail_api.error.code",
        "type": "deterministic"
      }
    },
    {
      "description": "zh_CN 运行时消息精确为批准模板。",
      "id": "EXP-BE-001-02",
      "oracle": {
        "expected_value": "维度或数据范围中使用了自定义维度字段，暂不支持查看明细",
        "matcher": "equals",
        "observation_point": "detail_api.error.message.zh_CN",
        "type": "deterministic"
      }
    },
    {
      "description": "en 运行时消息精确为批准模板。",
      "id": "EXP-BE-001-03",
      "oracle": {
        "expected_value": "Custom dimension fields are used in the dimension or data range. Details view is not supported.",
        "matcher": "equals",
        "observation_point": "detail_api.error.message.en",
        "type": "deterministic"
      }
    }
  ],
  "id": "TC-BE-001",
  "intent_ids": [
    "TC-BE-001"
  ],
  "layer": "backend",
  "preconditions": [
    "已构造并保存含自定义维度字段的统计图/拼表/交叉表资产，配置回查中精确出现自定义维度 ID"
  ],
  "priority": "P0",
  "risk": "critical",
  "source_refs": [
    {
      "id": "TC-BE-001",
      "location": "requirement-case",
      "type": "requirement"
    }
  ],
  "steps": [
    "构造并保存 dimension 变体资产，配置回查确认自定义维度 ID 出现在维度位置",
    "构造并保存 data_range 变体资产，配置回查确认自定义维度 ID 出现在数据范围位置",
    "构造并保存 drill_field 变体资产，配置回查确认自定义维度 ID 出现在下钻字段位置",
    "依次通过三个变体资产的查看明细入口实际触发查看明细，记录 detail_api 响应",
    "比对 detail_api.error 的 code、message.zh_CN、message.en 实际值与预期结果"
  ],
  "test_data": {
    "variants": [
      {
        "id": "dimension",
        "name": "自定义维度字段位于统计图维度位置"
      },
      {
        "id": "data_range",
        "name": "自定义维度字段位于数据范围位置"
      },
      {
        "id": "drill_field",
        "name": "自定义维度字段位于下钻字段位置"
      }
    ]
  },
  "title": "自定义维度三类位置的专用错误与双语提示"
}
